BOM.csv

Item,Qty,Supplier,Cost/item,Total Cost,link
Waveshare ESP32-S3-Zero,1,Waveshare,$5.16,$5.16,https://www.aliexpress.com/item/1005009890203011.html?spm=a2g0o.cart.0.0.5ee74ae45QOMi5&mp=1
MPR121,2,Realpoy Electronic,$3.46,$6.92,https://www.aliexpress.com/item/1005006960928952.html?spm=a2g0o.cart.0.0.5ee74ae45QOMi5&mp=1
"0.96"" OLED",1,YouKeyi Store,$2.78,$2.78,https://de.aliexpress.com/item/1005006141235306.html?spm=a2g0o.cart.0.0.5ee74ae45QOMi5&mp=1&gatewayAdapt=glo2deu
MCP23017,1,Silicone Patterned Store,$5.42,$5.42,https://de.aliexpress.com/item/1005009034247985.html?spm=a2g0o.cart.0.0.5ee74ae45QOMi5&mp=1&gatewayAdapt=glo2deu
CD72HC467M96,1,EC-Buying Ali Store,$2.35,$2.35,https://de.aliexpress.com/item/1005009412625122.html?spm=a2g0o.cart.0.0.5ee74ae45QOMi5&mp=1&gatewayAdapt=glo2deu
74AHCT1G125 SOT-23-5,1,ITECH Electronic,$4.40,$4.40,https://de.aliexpress.com/item/1005005936926220.html?spm=a2g0o.cart.0.0.5ee74ae45QOMi5&mp=1&gatewayAdapt=glo2deu
SK6812 mini-E,1,Venuss 777 Store,$5.08,$5.08,https://de.aliexpress.com/item/1005007863635868.html?spm=a2g0o.cart.0.0.5ee74ae45QOMi5&mp=1&gatewayAdapt=glo2deu
Alps EC11E encoder (w. sw),1,DQLZV Official Store,$2.21,$2.21,https://de.aliexpress.com/item/1005007644083514.html?spm=a2g0o.cart.0.0.5ee74ae45QOMi5&mp=1&gatewayAdapt=glo2deu
Estimated total shipping,1,,,$0.00,

README.md

# BOM

Item,Qty,Supplier,Cost/item,Total Cost,link
"Waveshare ESP32-S3-Zero","1","Waveshare","$5.16","$5.16","https://www.aliexpress.com/item/1005009890203011.html?spm=a2g0o.cart.0.0.5ee74ae45QOMi5&mp=1"
"MPR121","2","Realpoy Electronic","$3.46","$6.92","https://www.aliexpress.com/item/1005006960928952.html?spm=a2g0o.cart.0.0.5ee74ae45QOMi5&mp=1"
"0.96"" OLED",1,YouKeyi Store,$2.78,$2.78,https://de.aliexpress.com/item/1005006141235306.html?spm=a2g0o.cart.0.0.5ee74ae45QOMi5&mp=1&gatewayAdapt=glo2deu
MCP23017,1,Silicone Patterned Store,$5.42,$5.42,https://de.aliexpress.com/item/1005009034247985.html?spm=a2g0o.cart.0.0.5ee74ae45QOMi5&mp=1&gatewayAdapt=glo2deu
CD72HC467M96,1,EC-Buying Ali Store,$2.35,$2.35,https://de.aliexpress.com/item/1005009412625122.html?spm=a2g0o.cart.0.0.5ee74ae45QOMi5&mp=1&gatewayAdapt=glo2deu
74AHCT1G125 SOT-23-5,1,ITECH Electronic,$4.40,$4.40,https://de.aliexpress.com/item/1005005936926220.html?spm=a2g0o.cart.0.0.5ee74ae45QOMi5&mp=1&gatewayAdapt=glo2deu
SK6812 mini-E,1,Venuss 777 Store,$5.08,$5.08,https://de.aliexpress.com/item/1005007863635868.html?spm=a2g0o.cart.0.0.5ee74ae45QOMi5&mp=1&gatewayAdapt=glo2deu
Alps EC11E encoder (w. sw),1,DQLZV Official Store,$2.21,$2.21,https://de.aliexpress.com/item/1005007644083514.html?spm=a2g0o.cart.0.0.5ee74ae45QOMi5&mp=1&gatewayAdapt=glo2deu
kailh choc v1 sw,1,BQW Enterprise Store,$8.55,$8.55,https://de.aliexpress.com/item/1005006217606250.html?mp=1&gatewayAdapt=glo2deu
tactile switch 6x6,1,DNIGEF Electronices Store,$4.19,$4.19,https://de.aliexpress.com/item/1005005292705788.html?spm=a2g0o.cart.0.0.57104ae4sKWUUi&mp=1&gatewayAdapt=glo2deu
Estimated total shipping,1,,,$17.54,